Date,Opinion
22-07-2019,"What “I” look for in a car, hmm. When I was working I wanted something that was fun to drive, sporty looking, and got good mileage. A Hyundai Elantra Coupe worked for me - it was comfortable, was nicely equipped (it was the upper SE trim) and had a manual transmission. And it had adequate power, barely.

Now I’m retired, so I wanted a fun toy to drive. So I got a Mustang Ecoboost equipped exactly the way I wanted it. It’s fun to drive, has a ton of power without being nuts (like GTs, Demons, Hellcats, Shelbys, etc.) and it is purposely equipped - luxury stuff I could care less about, this is functional and comfortable. It MUST have premium fuel so that’s what I use. I don’t drive like I did when I worked so the mileage is lighter (only at 9K right now after 1.5 years). Another reason I chose the Mustang is there is a ton of aftermarket aesthetic and performance parts available for it, so I’ve been making this car MINE. It’s fun to work on, fun to mod and a blast to drive. But this is probably not something for someone who puts a lot of miles on a car and has to have solid dependability for daily driving. Or for someone to whom a car is simply a transportation appliance."
14-01-2019,"For a daily driver, I look for features that fit my needs. AWD, decent cargo space, decent power, and good MPG not requiring premium fuel. All for a good value. And I now always avoid low profile wheels which is any rim size 17” and above. A decent stereo is important as well and if I can get a sunroof for a decent cost, that’s a huge plus.

Then I narrow my options down by researching the maintenance schedule of each to see how frequent the service is and how costly. I if course research overall reliability. This is what many people fail to research and will likely make or break how much you end up enjoying the car. I won’t buy a car that uses a timing belt. I won’t purchase a car with a CVT automatic. And I won’t buy a car that can’t go at least 5k miles between oil changes.

I also like to look in the engine bay. Some cars have very tight engine compartments and how the engine is designed can make simple maintenance very difficult and time consuming. Subaru uses boxer style engines where the cylinders sit at the bottom of the bay. This makes changing spark plugs a huge job. My old Subaru took 3 hours to change the plugs (having the right ratchet extensions would have helped a little). Meanwhile my new Tucson has so much room, I can have the plugs swapped in 20 min."
Apr-18,"without knowing your priorities, we don’t know what *you* look for - but can offer ideas that others might consider.

If it is for a new driver - then perhaps something with a GOOD safety record and a long bonnet - more likely to have a prang or two when new to driving so having a lot of space between the front of the car and your legs is not a bad plan. Also if you dent a 15 year old car three days after buying it, it is not so upsetting as if the car is worth £15,000

If you need to do hundreds of miles a week and NEED reliability, then something newer and if you are not in a VERY well paid job, you might want to consider fuel economy too. If you have some spare cash to invest and reckon the sums add up, you might even toy with an electric or hybrid car.

If you have a family, you might want a 4 /5 door car - rather than a coupe - enough room for the kids plus luggage or a “hot hatch” just for you and the occasional date? That may make a difference to what you want.

So it depends on how much you want to spend, how many people will be in the car, how many miles a week you will do, how important efficiency is…….

The list goes on - but without knowing your priorities, it is hard to offer guidance.

If you do decide on any given car, then it can be worth using Google - with a search term like:

Honda Civic 2008 (reliability OR review OR problems)

and then see if there are loads of good things or bad things being said about that particular year or model of car.

I just ran that very search and the second result seemed to reckon that make/model/year has a 4.5 out of 5 rating averaged out over 141 (at time of writing) reviews.

This way, if you start to “favour” a particular car, you can see what the reliability seems to be like."
14-11-2018,"Personally, I like to look for things that are easily grabbed and quickly sold.

Leave a bag from a big box electronics store? I'm grabbing that.

Leave your cell phone and/or GPS in the dash holder? It's now mine.

Expensive Helly Hanson winter jacket? That'll fetch me $25.00 on the street.

There's a million things that I look for in a car. Things of value that you, the dim-witted shopping mall parker, doesn't think of those things, never hides them, all because those people don't care to know the truth of criminal activity. Little do they know, I'm watching every move of every car and driver, ready to leap into action and look for things in a car."
15-03-2019,"Ample room, for me and the person behind me. That means, two persons of 2 metres tall sitting behind eachother. With headroom.

Good driving abilities, cruising speeds of 200 kmh, since I live near the Autobahn.

Nice entertainment systems, selfdriving capabilities if possible.

My ideal car would be a box van, where we could lie down or play cards during the trip, the four of us.

A selfdriven Mercedes Marco Polo Van would be nice."
15-04-2018,"I ask myself two simple questions.

The questions are:

Is it front wheel drive? No

Does it have a V8? Yes

From there I consider options and maybe color but I use those two requirements to guide all my other choices.

That’s what I look for in a car."
04-03-2019,"Start from how you are going to use the car, how much money per month you are prepared to part with on maintenance, fuel, etc.

Just for an example, for a long time, I was a fan of Toyota Prado for its looks without realizing that this is a perfect car for offroad and terrain while I barely leave the city and highway where Prado feels bulky and not at all sporty and cool. When I had a chance to drive that car on the road, it was a total disappointment compared to sporty crossovers I prefer driving, although I am still fascinated by Prado exterior. As a result, I am not considering this car anymore.

Then decide whether you will buy it new or used. There are very good reasons for the former and the latter so, for me, it is more a religious question I would say. I always buy used, letting the first owner pay 50% of the car depreciation during the first couple of years. Of course, that requires due diligence on the car you are buying, looking for fresh well-cared-for cars with low mileage but this is another story.

When buying a new car, try several makes and models, visit dealerships, sit in a car and have a test drive, preferably in the conditions you are going to use the car, be it a highway or jammed downtown streets."
07-09-2017,"I have never bought a brand new car and never will. Buying used has served me well. I almost never buy from a car lot as they are middle men to the previous owner who is the person I want to deal with and talk to. First thing to look at is that owner, ask them how long they owned it, ask if it has ever been in an accident. Original owner cars are desirable, someone who has had it less than a year is suspect...just why don't you want this car you just bought? Ask them things about the car, how it was serviced, if there is anything at all wrong with it that they know of. They either will know of some thing(s) or not, but it is good to get their input. What they say can be verified by a mechanic or their service records they should have kept."
06-05-2020,"Here are some factors that you should consider before you look to purchase a car.

Budget :

The first place to start is with the financial side of things: determining your budget and what type of car you can afford to buy with that budget. The reason you need to make this decision sooner rather than later is because it can be easy to get sucked into spending more money on a car once you begin to look at them. Instead, get your budget together and stick to it.

Safety features :

The most important factor that anyone should look forward to while buying a car is its safety measures. Always cross-check the government rules regarding safety norms more stringent for Four-wheelers and two-wheelers. There are various factors that need to double-check in it. According to the law, all cars should have dual airbags, ABS, reverse parking sensors, as a part of standard equipment. Also, check for, additional security features like Autonomous Emergency Braking and steering with Electronic stability control, among others.

Insurance :

As a first time buyer, your car insurance cost will be very high due to your lack of experience or driving history. This, coupled with higher prices for more powerful cars, could lead you to pay an awful lot for your car insurance. To make these things simple, we always suggest that a new car has to be bought with comprehensive car insurance. It is because it offers add-ons to cover the depreciation value of your car, and offers consumables cover, which includes, consumable items such as AC gas etc more.

Needs :

Next up, you need to think about how you will be using the car and what your driving needs are. If you are simply going to be doing a short journey to work and back each day, with the occasional weekend jaunt, a small, economical car could be the answer. Alternatively, if you are going to be going on longer journeys with regularity, you should be looking for a bigger car, and potentially a newer one, which will be able to handle such long drives without breaking down or costing too much on gas.

Monthly costs:

As mentioned before, running a car costs money which you must consider before choosing which make and model you will buy. Monthly costs include car insurance fees, gas, general maintenance such as cleaning, and annual service. Naturally, each car will vary in terms of monthly costs. Some are more economical than others, some are more likely to break down than others, and insurance costs vary from car to car. Make sure you have considered the monthly cost of your chosen car."
28-11-2017,"This is one of the most crucial criteria while choosing a vehicle. This one basically determines what how the car will serve. Is it a family sedan? Or even an estate? Or a tiny city compact car? Or quite the contrary, forest pick-up truck? I don’t think this criteria needs further advice on what body type serves what purpose. Now this is a dealbreaker to me. Every engine type has its own special purpose which it is typically not serving. The obvious example are diesel engines. Diesels were originally designed for the purpose of having huge amount of torque for relatively small engine displacement and therefore, towing some heavy things behind them. They also generate this torque in really low RPMs so running for hours and hours is not a problem for them. Thus trucks were born.COMFORT and ADD ONS

There’s not much to talk about here, if you want heated seats, go for them but try to limit all the add ons to what you will actually use. I’m deliberately using the word “use” because a heated steering wheel simply isn’t something one would need.

PRICE, obviously

Also quite speaking for itself."
24-05-2017,"1. Safety

The reason Me place this at the first position among the things to check for in a new car is that regardless of the engine capacity and all other fancy features, if the car doesn’t have adequate safety features, it could be a disaster waiting to happen given the kind of road accident statistics reported in India.

Did you know that your car should ideally have “curtain” airbags along with the normal frontal airbags to protect your head when there is a sudden impact? These are meant to drop down from the roof and protect the head from whiplash. You could even ask for knee-protection. Also, vehicles are crash-tested and then given star ratings for their safety features. A five star rating, therefore, would be the most preferred. Some of the other safety features that you should check for include:

A. Electronic stability control- this would prevent the car from spinning out of control and sliding sideways when you make a turn at high speed or you suddenly need to swerve, which occurs quite often on Indian roads.

B. Anti-lock brakes – these come in handy when you need to stop your car suddenly, by preventing the wheels from locking up and the car from skidding.

C. Safety alerts – There are different types of safety alerts available such as motion detectors that warn you if another vehicle or object is too close and cameras attached to the rearview mirror that alert you with an alarm if you get distracted.

2. The Engine

Now that you know that your car is safe you need to check the two other important things that Indians are interested in, which is – how fast can this vehicle go and what is the fuel efficiency? Both these aspects are determined by the engine. There are two basic things to check here – the overall displacement of the motor in litres and the number of cylinders in the engine. For instance, a small car would usually have a 1.6 litre four-cylinder engine, which is great for fuel efficiency but might not give you rapid acceleration, especially on an incline. On the other hand, if you have a powerful engine, like a 6.2 litre, eight-cylinder one, you can whizz past everyone else but end up having to cough up much more for fuel, because efficiency here would suffer. Ideally, pick something that is suited for the type of driving you do – if you will be stuck in city traffic, the rapid acceleration won’t be any use.

3. Transmission

So, how do you like your gears to function? Are you looking for automatic transmission, where once you put the stick on drive, the car does all the work for you? Or are you a traditional stick shift lover? Did you know that some of the newer models come with “semi-automatic” transmission, where the clutch is automated and you only need to move the gear stick? While the choice of transmission will really not affect the performance of the vehicle, it would affect the cost, and, of course, the fun element. So choose wisely.

4. Cost of Ownership

This is a vital parameter to consider. It is advisable to have a good heart-to-heart with several dealers and specifically ask for all other hidden and apparent additional costs you might have to bear before you make the decision. One of the most important of these is your car insurance. It is mandatory by law in India that every new vehicle comes along with appropriate vehicle insurance. Nevertheless, you need to protect your assets to the best of your abilities and motor insurance could go a long way, especially in times of unfortunate accidents. The good news here is that many insurers and dealers offer special rebates and offers when you buy a brand new car. So, make sure you check for this while negotiating the deal.

5. Warranties

While your car is brand new, concerns regarding maintenance and servicing are likely to be minimal. However, with use and wear and tear, it certainly helps to have the best warranty on parts. Check with your dealer because most manufacturers have jumped onto the bandwagon to give warranties of up to five years to assert their quality benchmark. You will need to check whether the warranty depends on the number of years or kilometers driven, as well as whether some extended warranties are available. There also might be a few initial servicing deals thrown in by the dealer. So, don’t hesitate to ask about them. This helps ensure the best maintenance and smooth functioning of your vehicle.

6. Depreciation

Keep an eye on how much the car you love will depreciate over time. After all, most of us will look to upgrade our ride or at least get the latest model sooner or later. If the resale value of the current vehicle isn’t up to scratch, you might not even come up with the down-payment for the next one. It is a fact that some brands and models retain their resale value despite the passing years, while others depreciate rapidly causing you to actually lose money at the time of selling them.

7. Reversing Sensors & Cameras

Tight parking spots have become the norm in Indian metros. The best way to ensure that you do it right, without getting a scratch on your precious asset, is to check for parking and reversing aids. Then there is the risk of dogs hiding under the car to warm themselves in winter or hide from the blazing sunshine in summer. Without front and rear sensors, we might just start driving without realizing that we are putting another life at risk. And just in case the sensors give false alarm due to proximity to a plant or tree, you have the camera to check whether there is anything in the way. There are also cameras that work better at night than others. So, check for those too.

8. Navigation

Navigational aids can come really handy when you go on a road trip or move to a new city. Today most high-end automobiles come with such systems as standard equipment, you could add on a navigation unit to any car that you purchase. Check for those that offer freebies, such as map upgrades.

9. Automatic Headlights

Many times you would have noticed car drivers either leaving their headlights on even after parking the car or driving without headlights because the dashboard is backlit anyway. Now you can avoid such mistakes with automatic headlights that switch on themselves when the light dims, like when you enter a long tunnel or under-bridge. They also switch off automatically when the car is parked and locked. So, say goodbye to dead battery woes because you forgot to turn off the lights at night.

10. Freebies & Add-Ons

Never shy away from asking the dealer whether he is willing to throw in any freebies if you choose to buy the car from them. Some might offer you free servicing for a prolonged period, while others might offer extended warranty on some parts. In an attempt to boost sales, both the manufacturers and dealers offer various add-ons to entice customers. See if you can get a rebate on the premiums for car insurance or even a free holiday! Then there are those that promise gold coins and all sorts of bells and whistles to add on to the brand new car to make it all the more swanky."
21-06-2020,"The first thing which I would look for before buying any car would be The Legroom.

I would prefer a car which has larger legroom because I would like to travel in a spacious and comfortable car. The second thing which I would consider is the mileage. Mileage is very important due to the prevailing circumstances in our country. The fuel prices are increasing drastically day by day. Especially if you are a daily commuter, mileage would definitely matter a lot. I would not expect great mileage, but at least a decent one.

Third, the price of the car. Price matters a lot. If I feel that the car which I am going to buy is value for the money, I would definitely go for it. I personally don’t prefer cars with a lot of features(sunroof, cooled glovebox, wireless charging, Auto A/C, Keyless Entry, Different driving modes, etc). Instead, I would look for sheer driving pleasure. It doesn’t matter even if it has a manual transmission.

Fourth, as I mentioned earlier, I don’t prefer cars with a ton of features. Especially the information on the Instrument Cluster such as the average fuel economy, distance to empty, power or torque meter, etc. These are literally distracting while driving. I would simply reject cars with all these gimmicks. They aren’t really very useful. All these features are just for showing off before your relatives and friends. A simple analog instrument cluster is more than enough for me. Fifth, I would look for the performance pleasure of the car. The performance must satisfy ME and not my relatives or friends. I would check if the car could give a good feel to me. I would like to give you an advice. If you think the car doesn’t suit your style and nature of driving, please look for another car even though it gives excellent mileage and has unbeatable performance. Whenever you sit in the car, you must feel excited to drive it and that’s what I call performance pleasure. Even though it is powered by a 100BHP engine, it doesn’t matter unless and until you get the feel and excitement of the car. The performance must be satisfactory for you.

Finally, I would look for the car’s user reviews. I would follow Facebook pages of the car’s owner’s group. This helps me to get an idea about the car. This is a very important aspect to be considered before purchasing a car.

These are the things which I would consider before buying a car. I don’t care about which brand it is, because I am buying the car not for showing off and for selling it at a good cost. I am buying a car for my convenience."
28-06-2020,"when shopping for a car I put fuel economy high on the list. Also reliability. So my shopping starts with a lot of online research.

For where I live and the work I do, All wheel drive is indispensable. I also like to balance all that with a bit of sportiness and performance if I can. So how it feels when I drive it counts for much too.

If I’m shopping for new, then warrantee coverage means a lot to me as well. After that, it comes down to the deal. Can I get it for what I’m willing to pay. Before I go out, I have a budget set, a maximum. I try to shop when I’m not in a must-buy situation. I try to always be prepared to walk away. My mantra is “there will always be another deal. Another car.”

if im shopping used, it’s different. I just shop through ads mostly, see something I like that seems appropriate, and doesn’t look overpriced, then google it. Read reviews, look for what people complain about. I look in online forums specific to that car model, and see what people complain about. Try to see if I need to avoid that model of car. After that if I decide after some research that I’m interested, I look at car. I look for rust first and where is it. Significant rust underneath or any on the body, I take a pass. Is the interior clean, do the floors feel solid. I listen to the engine and I look at it too. Not all engines are quiet, but it should have a pretty monotonous drone, that just increases in tone when the accelerator is pressed. No squeaks or rattles or knocks. I don’t want to see rust everywhere or dirt everywhere or grease or oil everywhere and I don’t want to see signs of any fluid leaks. I check the fluids before start up to make sure they are the right colour and don’t indicate any problems. No signs of coolant in the oil or oil in the rad, which indicates a major engine problem. The oil also shouldn’t smell at all like fuel and the transmission fluid should not smell burnt. If the whole car smells of transmission fluid, I walk away. If it smells at all like it burns any oil, I walk away. If I smell anything electrical I walk away. I check that everything electrical on the car is working. It should start and idle easily. It shouldn’t hesitate when put in drive or when accelerating. It should shift into any gear without difficulty and without any funny noises or thump. All the rest is does it feel right when driving and stopping, or does anything feel off or worn out."
29-12-2019,"Purchasing a car can be really enjoying and a difficult task too.one may get confused while choosing a car for himself, and this happens when you not consider the important key points while purchasing a car

All these confusions lead us to a wrong selection of car for that we sometimes regret in future,so here are top 5 things one must consider while purchasing a car which leads to a great happiness than regret.

1.Looks Its one of the most important thing one should consider before purchasing a car,i know many of you will now be thinking that everyone considers it but let me tell you a majority of persons just go for brand names and in that case even the ugly looking cars are sometimes bought at higher prices that are not worth.but to a great extent look depends upon personal choice.But it matters,so consider a better looking car that is in good dimensions and eye-catching.

2.Pricing and offers

Its one of the most important thing one should consider before purchasing a car,i know many of you will now be thinking that everyone considers it but let me tell you a majority of persons just go for brand names and in that case even the ugly looking cars are sometimes bought at higher prices that are not worth.but to a great extent look depends upon personal choice.But it matters,so consider a better looking car that is in good dimensions and eye-catching.
I know everyone of you consider it cause i know money matters the most,but think in other ways like sometimes we purchase a car that was not worth spending for due to lack of knowledge.

For example,if one purchases a hyundai creta over kia seltos,it's not worth spending for, coz kia seltos offers more advanced features than creta ,so one must see if the car he is purchasing should be value for mone car.

3.Rate of interest Majority of us buy a car through loan on emi's,so one must be well aware about the ongoing rate of interests of different financial firms and one must properly see the loan amount or the interest amount.
Consider a bank that offers low rate of interest.

4.Safety features There is a negligence among lots of customers in considering safety features for their car, infact many of us are not aware that what are safety standards and we even purchase a 0 star NCAP test car.
So safety standards must be considered in any car purchase cause life is more precious than money

5.Car comparison

"
