Date,Opinion
20-05-2018,"Having just bought a car a couple years ago, bleh, I'll show you my process.

So at the start of it all we sat down and asked ourselves 3 questions:

What do we need a vehicle for?
What do we want from the vehicle?
How much are we willing to spend?
For us the answers were:

Family transport and light hauling.
Reliability, compactness, fuel efficiency, safety, and a big cargo space.
And less than $20,000.
All those answers meant we were looking at a lightly used hatchback or a small station wagon. Which meant at this time there were quite a few options for us, unlike when I got my last car about a decade earlier. At this point attrition kicked in: Chevy's only real hatchback was gutless, Ford's two hatchbacks had transmission issues people kept commenting on, VWs were too expensive for the most part, etc.

By the end of this we had a pre VW scandal Jetta wagon, a Mazda 5, and a Honda Fit to choose from. The Jetta was snapped up before we could see it so it came down to the Mazda 5 and the Fit. And that was a case of test drive both and then go home and sleep on it.

Becuase we really liked both.

The Mazda had good space, performance, and great seating. The Fit had decent space but snappier handling and very flexible seating. It also was smaller.

We went with the Fit.

And then shoved a dresser in it, moved a friend, and finally had a car that fit our small city mostly built before cars."
27-11-2017,"My criteria is in first of all what i use the car for, which size i should buy. Second thing i think about is it quite and comfortable ? Third thing is it reasonably reliable ? And fourth, is it worth the money asked for it ? Does it have any extras?

I purchased a Honda CR-V which was bought with P2P rental purposes in mind, so we got something spacious, reliable and with 4 wheel drive system. I quite like after owning it, it´s not the prettiest car out there, but it does everything quite well, some things feel a bit cheap in it, but in general it´s well made. (2007 model, executive version)

If pricing limit is not around my opinions change quite a bit, i do really like the Tesla Model S, it´s slightly down on quality, but think about it this way…this is Tesla second car - and it´s pretty awesome. The A4 paper-size screen is brilliant in the car, makes everything easy, the styling is superb and the tech is nice. Performance is just mind blowing. But one rule i have is to never go for the cheapest option cars of any range, rather buy the older model with more extras.

My personal choice is an old E-class Mercedes Benz (W124), i used to own one, and i have plans to buy me another one, they were made from 1986–1995 (some models vary like cabriolet ended in 1997 i believe), these have pretty much everything i look for in a car, the quality is superb, closing the doors makes a satisfying mechanic sound, a well maintained model will not have one thing that squeaks or rattles, they are quite, super comfortable with a nice suspension. Owning one today requires having many things replace because of age/wear , but i found it surprising that a 4 cylender model like E220 is not actually that expensive to maintain."
24-04-2019,"There can be several factors while buying it.

A few are :

Purpose : Decide for what purpose you are taking whether it is for family/official/fun/… Sort down the usage purpose on how many people travel on regular basis, on what kind of roads you are gonna ride, etc.

Budget : Decide your budget in which range you can afford for. Don’t exceed your budget much unless you find something too worthy in the higher versions. Try to get the best one in your budget.

Performance : Consider a good engine CC, power & torque while going for a vehicle. It decides how good your car can move head while pickup, rough terrains & typical Indian roads.

Petrol vehicles have a better pickup when compared to Diesel ones. Diesel ones need to maintained well & need to be used on a regular basis to be in condition. Petrol ones can be started with an ease even after days of not using it.

Mileage : Mileage is a main constraint for a family budget car. Look for the best one in the range of cars that you have in mind.

This is the one which should not make holes to your pocket.

Safety & Breaking :
Last but not the least !

In fact, the most important one.

Because, you need to be alive to ride your car right !? So, never compromise with the safety part.

Car with Airbags is a must. (Atleast 2 - one for driver & other for co-driver).

Choose the one which has a good breaking system like ABS or an equivalent one. A good breaking system can avoid most of the mishaps. etter avoid the base versions of any model. Most of the times they won’t be having any kind of safety specifications.

Go for the model which have the minimum/basic safety specs & a tougher build quality material.

Research & Reviews :

You need to enough homework before choosing your dream car.

Because, some well analysed reviews might change the perception of yours towards a car. It can be in a good or a bad way.

That is very important."
22-01-2020,"1.) I have to like it

2.) A certain amount of practicality (as in “an M5 has four doors and a boot”)

3.) Can pay for it in cash

4.) Not new, from a brand I consider acceptable (this is quite an obstacle)

There are still “dealbreakers”. In 2005, I was considering to replace my Alfa 156 2.5 V6 with a 159 3.2 V6 Q4 (four-wheel drive) two or three years down the road. Then I’ve read that this actually wasn’t an Alfa engine, but one from Holden (GM) which already killed it. Then there was a test which vaporised the corpse, so to speak. The 159 was no less than 400 kg heavier than my 156, and due to this the 3.2-liter with 70 more horsepowers didn’t really deliver better performance. To disperse the corpse vapour, average fuel consumption was in the range of 17 liters per 100 km, a third more than my already thirsty 156. Weight and performance would have sunk it either way, the fuel consumption might not have.

This time my sights are set on a Giulia QV, which in two years should be available below 40.000 euros. Admittedly, a 510-hp engine is rather useless for me since most of my mileage is driven to and from work, but almost 17 years with the 156 have bent me somehow - I want a V6 engine again, and the QV is the only Alfa featuring one. The 280-hp, straight-four, turbocharged Veloce with four-wheel drive is definitely the reasonable choice in pretty much every regard, but reason already had its fill with four doors and a boot. Can’t be reasonable all the time, or we’d all drive wheeled tranquilisers."
01-04-2018,"There are 80% chances when you buy a car then you face some problems. But I am sure that if you read this carefully then you get tips and tricks to get the best deal when you buying a car.

Tips for buying a car:

Research:

Pre-Financing Options:

Buy From Nearer Store:

Negotiate For Best Price Of The Car:

Choose the best from a new and used car:

Purchase Vichele on purchase price never purchase based on monthly payments:

Best Source is Internet:

Never Mention Your Trade

Know The Factors of Insurance Cost

Avoid Sudden Purchasing

Never waste money on Add-Ons

Never go with extended warranty offer

Take a test drive in your car

Visit the mechanic when buying a used car

Go with your budget"
19-02-2019,"Some of the factors which can affect your decision of buying a car are :—

1- Budget — Determine your budget first and then search for cars which belongs to your budget only. Don't do any research on either expensive or cheap cars.

2- Type of Car (Segment) — Decide which type of car you want :—

Hatchback — smooth city drive, great mileage, in budget

Compact Sedan — comfortable city drive, a bit larger space, good mileage, in budget, additional features

Sedan — a bit luxury, good space, comfortable for driving for long distance

SUV — Powerful, comfortable, meant for long driving sessions, other great features

3- Purpose for buying car : An individual can buy a car for two purposes :—

(a) Personal Use — If you want to purchase a car for personal use then go for comfortable and medium range or high range car.

(b) Commercial Use — If for commercial purposes then go for non-expensive and comfortable cars. As they will cover cost faster and also earns you good profits. Some options are :

• If you want to invest your car in Ola and Uber then you can purchase Hyundai i10, Swift Dzire (Base model) etc.

• And if you want to start you tour and travel agency then go for Toyota Etios (very comfortable), Swift Dzire (Mid-Range model), Innova, etc.

4- Petrol / Diesel — Decide which car you want to purchase a diesel variant or petrol :—

Petrol Variant — If you are purchasing car for personal use and you will not use the car for longer periods at a time then go for petrol versions.

Diesel Variant — If you are purchasing car for commercial use and will use the car regularly for longer periods then go for diesel variant. As diesel is cheaper than petrol so it will increase your profits.

5- Features of car — If you want to make your ride comfortable then go for a car having good features like auto climate, cruise control, controls on steering etc.

Other factors are safety features, no. of members in your family, design, colour, brand of the car, etc."
03-03-2019,"Without going on and on, which I could, here are a few things to keep in mind:

Budget. How much can you realistically afford? Don’t overbuy just because the salesman convinces you that the financing is cheap. It’s not!
Be careful. Don’t look at a car and base all of your decisions on a car just because someone else thinks it’s “the car for you”.
Sit in the car and make sure that it fits you. Often overlooked topic. How does your butt fit in the seat? Can you adjust the seat back into a comfortable position? Do your feet reach the pedals in a very comfortable position? Where does the seat belt ride on you? Can you use the rearview mirrors safely?
Sight-lines and blind spots. Can you see everything? A major cause of accidents is that drivers can't see what they are about to hit. Many newer car designs include sensors and cameras. Plan on getting used to using them.
What style car do you want? An SUV? A 4 door sedan? A pick-up truck? A sports car? An all-wheel-drive car? Be realistic. Find the style that you want. Do you want to be trendy or not? Do you want to express yourself through your car? How much fun do you get out of driving?
Don’t buy an all-wheel-drive car unless you really need it. They are more expensive and don’t get as good gas mileage. But, AWD cars are great if you have a use for it.
Cupholders. We live in a Starbucks world!
How important is cargo room?
And, read Consumer’s Reports. The best place to get unbiased car reviews. It’s interesting how they do their research on a car. They don’t sell advertising on the products that they review. And, so cool here, they have an undercover process where they actually purchase the cars that they review without letting the sales people know where the car is headed. Also, they review the cars with respect to how the normal driver is going to use them. They don’t care how much G-force it can do on a race track!"
17-04-2018,"It depends.

New or Used? This makes huge difference.

New: Good price. Compare it to other cars that were sold in the area. Do your research and go into it with the intention of walking away. As far as what to look for , id say just make sure there are no dings / chips/ dents . No noises when driving the car. Open the hood make sure everything is clean/ no corrosion on the battery terminals (my last new car had a bad battery and it was new) . Not much you can tell right away from a New car but it has a warranty.

Used: Depending on your price range and your expectations this could change. For instance if you buy an $800 car you wouldn’t complain about some scratches or rust etc. You just want it to drive and pass inspection if its required in your state. Check the turn signals , brake lights , clutch if it has one. headlights.

The hard to judge area is probably a used car 3–8 years old. In which case id spend some time figuring out what you want. When you find it , do some research on that exact model. Scour the forums for common problems and ask the seller if they have been addressed or if they have never had an issue.

Check the brakes , tire tread / wear , oil can tell you quite a bit. Pull a spark plug.
Test drive it . Make sure there is no odd noises or lack of power. Let it run for a bit , make sure the fan kicks on and it doesnt overheat. Smoke from the exhaust."
19-04-2019,"It’s the overall ownership experience (includes maintenance, reliability and brand value of the company/car).
It might be different for me if I am buying say for example a second car. I will look only for performance and a manageable service network.
Apart from the ownership experience, I’d like to consider whether that particular car model is successful or not. This might not matter to some but a successful model is comparatively easy to maintain and these models do have a great resale value. Say for example, Hyundai Creta. We all know how much successful it is. You won’t find that level of resale value in Mahindra TUV 3OO. This is the difference.
And you cannot ignore the mileage of the car. It’s directly related to your pocket. Though most cars now give acceptable mileage (within their segment of course) but still mileage considerations matter.
Engine, build quality and safety features."
06-11-2019,"The best choice of car for us is a combination of what works for us and what we love most. So, when we are facing to buy a car, we need to develop a self-selecting rule. Since choosing a car is more difficult for female, I recommend the following five steps. To put it all together, it’s constantly subtracting:

- Firstly, the budget. For car selection, price is the main premise. For example, if you have a budget of $30,000, what is. Your acceptable range? $30,000 to 35,000? This can rule out a large number of cars, generally 20 choices left.

- Second, the models. Sportscar? Sedan? SUV? You have to decide the big model, which again rules out most of the cars. Adding the chosen price, leaving 10 choices.

- Third, the brand. After the price and model are determined, you need to choose the brand of the car. For example, Japanese, German and American cars. Here, some of the cars are excluded and left with no more than 10 choices.

- Fourth, the integrity of exterior, interior and color. You can look at several choices. In. selected prices, models and brands. In horizontal comparison, there are usually 4 or 5 choices left.

- Finally, the displacement.

The mentioned above are the car-selecting rule that tends to be female and, if male, the performance should also be considered."
17-03-2018,"I have an array of vehicles so I will tell you why I bought each. My 2000 f150 2wd. Well I inherited it but it replaced my 89 f150 2wd. I used it as my daily driver and did some work with it on the weekends. If you want to haul things you need a truck. Next my 2000 Firehawk trans am. Not did I buy the wrong car for the intrnded purpose. I wanted a sporty car that I could take on road trips approximately 1–2 days in length. Ha. I drove it about 2 hours and realized my butt was taking a lot of bouncing around from it's firm suspension..it is fast though. So much so that I am afraid to drive it much as I cannot keep it under 100 mph most of the time. It just wants to be there. Doesn't feel dangerous at all. It sticks to the road and with the improved cross drilled slotted rotors and ebc brake pads it stops real nice too. Well that brings me to the gem of my fleet. A 2005 Mercury Montego. You wouldn't give this sedsn a second look but drive it and you know it's all about road trips. Set the cruise, relax with the AC on and when you get there you get there. It's the car for those trips I was talking about. Skip the AWD if your thinking about buying one. Have heard bad thongs about the cvt transmission they have thankfully mines just fwd. Well recently I finally plunked down some greenbacks for a replacement to the 2000 f150 I have been driving for years. She still drives well but she was rusty and doesn't do so well in the snow cone winter. My lady went on a road trip last year with friends and came back raving about the nice fx4 f150 they drove. So I was ready for a replacement for trusty but rusty f150 I had so when a friend posted he was thinking about selling his sharp looking black 2009 fx4 extended cab I scooped it up. Soon we will sell the rusty 2wd f150. She has been good to us but you have to let them go sometime."
13-12-2015,"1) Budget.

This will help you narrow down your search of what exactly you are looking for.

2) Milage

One of important consideration to be made.

3) Power

Depends on where and how you wana drive it.

4) Saftey

ABS , Airbags.

5) Looks

choice can very from person to person

6) Features

Just dont get carried out by sub models ie E,EX,S,SV,V,VX .. See what you really want , you can upgrade your car anytime later .

Fact is this submodels ie V,VX are overpriced .

Decide how much luxury you really need.

S

7) Transmission type

Auto preferably if congested city driving without hassels.

Manual .

8) After purchase Service

9) Maintaince

10) Never think of purchasing Discontinued models or models about to be discontinued .

T

11) Parts availability

12) Offers available during purchase."
24-10-2018,"The first feature which everyone looks for while buying a car is safety. Without safety no one will ever look to buy a new car. Let me list down the features which is required to buy a new car. As a beginner you should know what things are needed:

Check for the engines whether they are in a perfect condition
Check for how fast can this car go and the fuel capacity of vehicle
Check for the transmission as the gear operates automatically or manually depending on your needs
Ask for whether the warranty depends on number of years or kilometers driven and whether it can be extended or not
Check if the reverse camera or sensor is pre-installed or not
Confirm for any freebies or add-ons with dealer while buying a car"
03-04-2018,"While purchasing a car the following points are to be considered:

1.The on road price (including life tax,comprehensive insurance and other

taxes and expenditure)

2.Ground clearance of the car,as the humps on the road are unscientific,pot holes,conditions of the Bangalore BBMP road.Minimum of 200 cms are required

3.Length of the car to be considered for easy parking in the city areas.

4.Fuel efficiency i.e KMPL is to beconsidred

5.Safety feature like air bags,cross bars,breaking efficiency,EBD,uphill breaking and ABS are to be considered

6.Interior comforts,smoothness of the car, visibility and dashboard comforts are to be considered.

7. Take a test drive of different cars as per your financial affordability,compare the driving comforts,breaking efficiency etc.

8.Finally nearness of the service station to your house,for easy servicing shall be

worth considering"
25-05-2020,"I like sleeper cars(blends in with the public, but has much more power than it appears). The first thing I look for in a car is the engine. It must be powerful and it must be a proven engine, typically one used in a sports car or pickup. The next thing I look for is a 4 door vehicle with lots of leg and cargo space that has that ideal engine. Fortunately for me these types of cars go cheap on the used market as the market has moved away from sedans and wagons. So I usually end up buying one that is loaded and less than 4 years old for a bargain."
28-11-2019,"The most important thing to consider when looking at buying a car is your budget. You may want that gorgeous Bentley Mulsanne to glide you to work everyday, but you might only be able to afford this: After you determine how much you are willing to spend, consider some of the following questions:

How many people do you need/ want to fit in your car on a regular basis?
Do you want sit higher from the ground as in an SUV or do you want the low center of gravity found in most sedans and coupes.
How much trunk space do you need/ would you prefer a hatch or wagon?
Do you care if it’s performance oriented or do you just want to get around?
Would you rather a used and more luxurious car or a new and less luxurious car of equal price?
How long do you need the car to last? Should you pick the reliable and sensible option over the fun car that needs new parts every 5,000 miles?"
10-03-2019,"I would consider the following.

Type Of Car

Obviously you can't head over to showrooms or dealerships without knowing what you want

Practicality

Choose a Car which suits your work and the amount of load you would've to take everyday or every weekend. if you're having a family but want to have fun and go to grocery or mall every weekend, choose a Hot hatch (ex- Suzuki Swift) or a sport sedan (ex- Hyundai Genesis)

Fun

If you want only fun and do not care about the leg room, safety etc. You might want to go for a Sport Sedan or maybe a sports car.

Affordability

You need not to be a millionaire to afford a Nissan GTR or maybe a Mercedes GTS. Only thing you need to find is a trusted car dealing website where such cars are being sold for almost half price and only a decent amount of Kms driven.

Reliability

If you live in a country where Tata or Audis or etc. Are rare, expensive to maintain and find spare parts and planning to Buy one of those, then make up your mind because you'll spend your life importing the spare parts At a reasonably high price due to taxes ."
05-10-2017,"There is an awesome article in team-bhp for the same and I follow the same whener me or my friends are taking the delivery of a car. You can check below for the same.

ARTICLE: Pre-delivery Inspection (PDI) & Check List - Team-BHP

If you are mainly asking for buying a car (not delivery) you can consider the following aspects.

Of course, budget - at what max you can spend on a car.
List out different models that comes in the budget that you want
Test drive all the cars without any hesitation
Lookout different options like ABS, Airbags definitely for safety purposes.
Resale value of the car in future
Availability of services centers, parts of the car in nearby area you live.
If you opting for a loan, check with different bank interest rates as well."
28-04-2018,"We must keep following things in our mind.

Make sure that the car is not involved in any illegal activity.
Check the documents property.
Make sure the engine number of car is same as mentioned in the documents.
The car must be best according to our needs.
Don't buy too old models.
Check the engine condition.
Don't pay too high.
Pay according to the condition of the body, AC, engine, clutch plate and tyres.
Don't be too quick in buying an old car. It's not easy to find a good condition vehicle in a short period of time.
Prefer local area number car.
If you don't have good knowledge of vehicle, then first let a good mechanic check the car that you think of buying."
28-11-2017,"Criteria will obviously vary widely from one buyer to another, but for me personally…

Must have a lot of interior space. Enough to camp in, haul cargo, motorcycles and people with. This usually means a full-size van.
Must have enough power to pull a trailer with. This usually means a larger V8 engine.
Must not be too expensive. This usually means a used vehicle.
Must not have any body rust.
Should be easy to work on myself.
Should have good fuel capacity for decent range.
Should have a good service record, low miles and no accidents.
Finally, I lean towards things that are unique in appearance, but still cool in their own way."
31-01-2020,"Intended use for the vehicle
- Personal budget for the vehicle
- The vehicle’s reliability
- Expected maintenance over the lifetime of the vehicle
- Comfort
- Desired features (features can include fuel economy, type of interior, safety features, driving features, electric motor, etc)

I purposely did not mention safety as vehicles these days meet the necessary requirements to be safely driven on the road. Though your desired features may and can include additional safety measures."
07-04-2019,"Price..Brand…Color…Condition…Decide your price range…Decide the brand you think you want..Decide on several color options…(Never buy a dark colored vehicle)…Watch for condition…First glance look at tires, look at control pedals, steering wheel condition…mis-matched paint textures, color….dents…rust…if these items look good pop the hood and look closely for oil and anti-freeze leaks…I always look underneath at all costs(dirty knees?)…Finally test drive…if in doubt axe to take it in to a dealer for a “condition check”…usually $100."
