Date,Opinion
30-10-2019,"To get a car it is important to take certain criteria under consideration. The automobile industry right now is at a rapid pace where the auto sector contributes 7.1 % of countries' whole GDP. As new cars are in demand soo much to get it more offerable to some people the used car market is growing widely too.
Some factors you have to consider while buying a car are-

Check out the interior of the car, the fabric and other features like the navigation system, USB port connection, storage space, etc. Make sure that you check the odometer. Check out the exterior of the car the panels, doors, glass, etc. Examine every aspect of the car before you take the key in your hand. Check out the engines.
Once you have inspected the car correctly take it for a spin. When you take for a test drive you would know the power of your car, the comforts and whether you should consider buying or go for a second choice."
19-04-2019,"Share are factors:

Reliability
Enough space (but I don't need a SUV)
Reasonable price (not over priced like Audi, BMW or Mercedes)
Well equipped
Comfortable
What are not factors:

Resale value ( I keep my cars for a long time=10 years)
Prestige: I have had Audi A6, BMW 530, Mercedes C-Class, but now I have a Hyundai and am very satisfied.
Sportiness: As long as it does up to 180 km/h and keeps up with the traffic, that's good enough for me."
23-05-2019,"I just about always buy used. I am not hung up on having a new car and they lose too much of their value in the first year.

First and foremost long term reliability. I do not replace a car until it is good and done and I want that to be at least 200K miles. Starting with a reliable car is important and that usually means a Toyota or a Honda though some other cars meet that criterion.

Second it cannot be too big. That is just me. I would love a Fiat 500 if it were not so unreliable.

Third it has to be safe. Then again, almost every car is reasonably safe these days.

Of course it has to be good on gas but if it is small it will be.

All of these will add up to value."
24-11-2018,"As someone who does triathlons and travels, I was looking for a car that I could put a full-size bicycle hard case in and close the trunk. This alone ruled out half of the sedans that did not have folding rear seats. Also, keeping a car on average 15 years to 20 years meant getting a very reliable model with low ownership costs. Lastly as this vehicle would be a commuter it had to get decent mileage in the city but also offer performance with comfort. Now when I mean decent, I am not talking about hybrid vehicles as to me the whole issue of batteries means another component to break, but something that not only gives me over 21 mpg but is fun to drive."
27-05-2018,"You need to take a pen and paper and answer the following questions.

Do i really need a car ? If yes, why ?
If the answer is NO then that's the end of it. If yes, and you are satisfied with the answer then the next question is how much are you comfortable spending.
Once budget is fixed you can go to websites like carwale or cardekho and see what all cars are available in that budget.
Do you need a hatchback, compact sedan, sedan, or crossover or SUV ? The answer depends on the places where the car is mostly intended to be used.
TEST DRIVE the car atleast twice or even thrice from multiple dealerships. No one can judge if you like driving the car except you. See the posture, height, seat comfort , visibility , engine driveability, ride quality, NVH, A.C. Etc.
Negotiate hard. If you're price conscious then take quotes from various dealerships and bargain hard for freebies or accessories. Take the dealerships track record in consideration. Do a thorough PDI from stockyard before you sign on the papers."
26-10-2019,"Everyone has a different criteria for a car. Find what you need, not what you want. If you need a pickup truck, don’t a buy Ford because it’s ”Ford” buy a reliable truck that you know you can afford and is easy to repair then save up to buy that Ford you love so much.

Personal story time: My first car was a modified honda accord and I loved it. However it got me in so much trouble (Actively and Passively) the police were called on me multiple times because I was driving around with a loud exhaust. It didn't help that I lived in a small town and got off of work late at night. I got pulled over almost every night. The car wasn't well taken cared of because I couldn't afford to. Now it sits in my driveway because I hit two deer and the timing is jumped."
27-05-2018,"There are many factors that u need to consider while buying a car…..like type of car - Hatchback, Sedan or SUV.

Which type of application you ar egoing to use for etc..

I am not a good experienced guy with cars in real…..so i will just give u a link that explains very well about one of the major things that u need to consider, that many people arent aware of……

That is - Cost of ownership."
01-10-2019,"Affordability, if I can't pay for it why even discuss it? I usually measure this in total costs divided by miles. Affordable is 50 cents per mile, unaffordable is $1.50.

Safety, airbags, antilock, crumple zones, back-up camera, good steering and braking, etc.

Capacity, carrying, towing, seating, by volume and weight.

Comfort, quiet, ac, ergonomics, convenience features.

Affordability, Safety, Capacity, and Comfort. There you have it."
02-10-2018,"A good review from a respected source, such as Consumer’s Union (Consumer Reports)
Low mileage
A previously owned vehicle: new car depreciation is just killer
Well maintained, both the interior and under the hood
A good deal: the price compares favorably, or is on par, with similar vehicles on the local market at the time
Edit: Do your homework before you go look at any cars. If something doesn’t smell right, don’t be afraid to say no. As long as you have that money in your hand, you have more power than you may think. Take your time. Remember: you’re going to live with that car for years. You don’t get a prize for buying something quickly, no matter what the car dealer says."
18-06-2018,"I only buy secondhand, so at first the general condition, millage, maintenance and having a APK (MOT) or not, but before i go look at a car in person i checked out the availability and price of spareparts, fuel economy and in the Netherlands very important the weight, the roadtax is calculated by weight and sometimes a car 1 kilo heavier will land it in a more expensive roadtax level, for a petrol car this saves you about 150 euro yearly and for a diesel it is a whopping 700 euro, a expensive kilo.

For options a airco is a must and finding a car without powersteering these days is sheer impossible, cruise control is welcome but for the rest i don’t care, except a stereo i don’t need it, and what is not on it can’t break down .

And it needs to be a stationcar, i haul each week a lot of stuff from and to fleamarkets a small comercial vehicle is not an option, sometimes i have to drive my parents."
04-10-2017,"Things you should check before buying a pre-owned vehicle.

Car History. You should never buy a car with a bad history like if the title is salvage. Also check if this vehicle has any accidents.
Maintence. See if the vehicle is running well. You can tell if it's not running well if you hear the engine squeaking. Try to rev and speed the car when test driving.
Exterior. Check the body if theres any rust, dings. Check the tires if there is anymore thread on the tires.
Make sure you can afford and negotiate the price when buying your vehicle
What to check when buying a new vehicle.

Check if it has the right specs you need it for, towing, etc.
Make sure you can afford the vehicle and negotiate the price."
28-11-2017," like to modify my cars or trucks for more performance and better looks. I also don’t like repairing stupid problems that may arise from poor build quality or lack of long term component testing, so that eliminates German vehicles.

My list of criteria includes:

Massive aftermarket support for modifications.
Relatively easy to work on in terms of performing modifications.
reliable and durable
Something that suits my personality and lifestyle
That’s about it. I’m not worried about practicality or depreciation or status. I just want a big, expensive, fun toy."
19-04-2018,"For me, two major parts are enjoyment of the interior (it doesn’t need to be Audi or Mercedes, but I’m not content with the plasticky American interiors nor the poorly fit together interiors of many Japanese and Korean brands like Hyundai and Nissan). The other is the fun to drive. CVT transmissions are an automatic no, and cars with poor steering, underpowered engines, and spongy suspension and braking are a no. I’m willing to spend a couple extra dollars for the enjoyment. I don’t want to spend my time in something that will only “get me from A to B” and only not fall apart."
03-11-2016,". When looking out for a used car for , make sure you determine how much you can spend on it.

2. Do some research on the vehicle you are looking to buy.

3. Make sure that the car you are buying is certified.

You can find a fleet of cars ranging from low to high, sedan to luxury cars, etc. In short, if you are considering buying a secondhand car, make Motor2Go as your prime choice. "
28-06-2018,"The following points are to be taken into account while buying an used car:

The year of make and the year of purchase by previous owner.
The number of kilometers clocked on the odo.
The exterior body condition for probable rust development and damages to the chassis.
The engine condition along with its service history and logs
Probable accident history of the concerned vehicle, if any.
Number of owners before the current buyer with proper ownership records."
06-06-2018,"Requirement (power, space,comfort, image)
capability to pay EMI, maintenance.
Avg running per month & type of road to be used highway / city. (low running means buy petrol , only city means buy less powerful car )
brand popularity in the area in which you stay. (for ease of service , spares, resale value)
personal preference. (i love Honda / I want SUV like that)
How many years the car will be with you. (for frequent change take a Japanese car as it gives good resale value).
etc etc."
04-04-2019,"Consider safety. People still die in car accidents! Do research on reliability and fuel economy and cost of maintenance. When you work out which car you want, go to a reputable car dealer (if you are buying used) and ensure you get it checked by an expert (you never know the true history of a used car) and try to get a car with a full service history. If buying new, consider using a car broker to bargain for you."
24-10-2018,"My cars have always been:

elegant; as in, Rolls-Royce-like
powerful; I need a six- or eight cylinder with at least 200 horsepower
durable; I expect twenty to thirty years of life with me, minimum;
economical; it must be capable of at least 25 mpg
exotic; I’m ready for a big car from China, Russia, or Brazil
If there was an alien luxury sedan, I’d have one."
30-06-2016,"First of all determine your budget. Then according to the terrain you'd drive in, determine the segment whether a hatchback, sedan, crossover or an suv. After that how much you will drive, a rough idea in kms. If you're gonna drive more than 1300kms a month, go for diesel if less then stick with the petrol version. After that the maintenance cost of the car, for this purpose you'd have to classify the car brands. And again for the resale purpose you'll have to classify the brands accordingly."
25-10-2018,"What am I PAIF ing for? I use a hand written spread sheet.

1). Credible Provenience (history). Including and often overlooked: all important questions regarding “What are your reasons for selling this piece?” (especially with a Private Party).

2). Professional inspection/Appraisal. On-line research.

3). Insurability. What are the premium payments on this thing?

4). Financeabilility (self or other), to avail a close of the sale soonest.

Not necessarily in that order.

Looking well after these four points will assuredly improve the luck of your draw.

Someone once told me “You tend to make more money when buying a device, than when selling it”."
26-06-2018,"1. If your not paying cash, what the finance charge will be over the entire loan.
2. The cost of regular service according to the manufacture guidelines.
3. Exit strategy should also be considered. (I will drive it until it has x amount of miles and it should be worth Y)
4. Resale value."
24-02-2017,1st looking…car look is very important than check comfort ..seats lether..ground clearance..and service senter of car company… you also check milege power…and also compare 2 or 3 cars at a time…in one segment…advance feature are available or not .
28-04-2018,"Accidental or not

How to check: open any door, there you’ll see rubber beading- pull it out and look carefully at small circles- these circles are put up by manufacturing units and they are spread across the body line of the whole car.. if some circles are missing that means the car has been repaired from the sides..

Similar circles are found in the boot too.

Now only the hood remains- check the underside of the hood for a thick gum like thingy and it should be spread from one end to the other.. if not- repaired!!

Then check how much the car is run on the odo and get it verified by the service centre.

Always buy from a know dealer"
31-05-2016,"firstly you may have to deside which engine is required for you its diesel or petrol

then you have to need to know that which company gives best and cheapest services in your area then safety features in car and lastly the bettre option in your budget"
28-11-2017,"Has to be a V8, run on Gasoline, be American, and actually exciting to drive."
06-06-2020,"10 Factors to Consider When Buying a Used Car:

1. Budget,

2. Vehicle history,

3. Pre-Purchase inspection,

4. Reputation,

5. Driving,

6. Lifestyle,

7. Financing,

8. Warranty,

9. Insurance,

10. Ownership and Car Title."
28-0302019,i would suggest look for accident history and most important if car has been periodically serviced as mandated
25-02-2020,Make sure the engine and other parts are still in a good condition. Take a friend who is good at identifying problems so you are not buying a junker.
06-03-2018,"I think about it as follows: I don't look at any specific cars first but try to follow this logic...

1. Start with working out a BUDGET. Whether you're planning to lease, hire purchase or just purchase outright this is probably the most important question to answer. If you're paying monthly, there are many calculators online that can assist you in working out a purchase price based on your monthly allowance. Don't forget to allow for fuel economy, type of fuel, maintenance and insurance in your calculations!

2. Next, decide whether you're buying new, lightly used/demonstrator/1 year old or just used. If you can eliminate one or two of those options then you're potential car options become narrower and easier to manage.

3. Make a list of what you NEED from a car (e.g. 4 doors, off-road ability, automatic transmission) vs. what is a NICE-TO-HAVE (e.g. Bluetooth). Everyone has differing priorities here - one person might absolutely need Bluetooth, whilst the next wouldn't even know if it was there. Once you've made this list, it's time to start looking at actual car options. Take point 1, 2 and 3 sequentially and apply them to a car catalogue, online car supermarket, car magazine or any resource which is comprehensive enough to cover most cars for sale.

At this point, I feel most people would already be at just 4 or 5 options. If you have more, then you've taken a wrong step somewhere - go back: is your budget range too wide? Have you not been specific enough in your needs? Are you SURE you don't mind whether a car is brand new or a decade old?

Some people might now be able to eliminate one or two options immediately based on past experience or brand perception.

You should now be down to 3 or 4 options. My advice...?

4. Go drive them all. Without sitting in them, driving them and being exposed to the sales team it is impossible to tease out or predict the differences between similar cars from different manufacturers. You will be surprised at how much 3 cars that are similar on paper differ in real life! With the 3 options freshly driven, hopefully one will stand out for being quieter, more attractive, or even just having a salesman who makes you feel at ease.

5. Lastly, if it comes down to it, get the one you will be proud to own. If you can turn back and look at it when you walk away or derive some joy from it after a long day's work, then all the better!"
06-04-2019,"Affordability, practicality and style.

First, and foremost, you need to shop within your budget. My sincere congrats if you don't have/need one of those. Never forget that along with a car purchase usually comes increased taxes and insurance.

Second is practicality. If you are a tradesman then a Miata may not be right for you. The vehicle should closely match how you plan to use it A commuter would probably want good economy while a tradesman would want a pickup or van.

Lastly, a last for a reason, is style. We all get romantic about shapes and designs that affect us whether it's a Corvette, a Porsche, an F-150 or a Beetle. The point is that you need to satisfy the first two criteria before you satisfy the third. If you are lucky enough to hit all three ""on the screws"" then you are indeed fortunate that your needs and tastes align. Further, if you are one who cares not a whit about style then the first two are easily obtainable among the myriad offerings of today's automobiles."
10-02-2020,"You have to look at yourself ...what kind of situation are you in (like single, married, married with kid on the way, married with kid or kids). That's a huge determiner of what kind of vehicle you should get. Obviously if you're unattached and single then the automotive world is your oyster. Really. Get whatever makes your pulse run faster. Or ....get what'll haul all your outdoor toys and get you to where the action is.

You can wade thru any number of online resources to get reviews and evaluations of just about any kind of vehicle ever made. Your part is to figure out what you want ...nobody can do that for you ...especially none of us becasue we don't *know* you. You know you so start there. You wanna sports car? 4-WD vehicle like a Jeep? A truck? Like I said, the automotive world is your oyster. And it's only a car. If you buy it, finance it, and decide you hate it ...well you can trade it in and start anew. Yeah, you'll take a hit in the wallet but these days with all the sales incentives it won't be too painful."
07-03-2016,"1. Decide what type of car you want. Coupe, sedan pick-up, SUV etc.
2. Decide what attributes are most important to you. Comfort, style, cost, handling economy whatever.
3. Pick at least three cars that meet your criteria, then check reviews on each. Reviews can be found on-line for just about anything. Check motor-head magazines.
4. Check into fleet/commercial use if any. Especially law enforcement and large corporation fleets. Cars selected are usually extensively tested before being committed as a fleet vehicle. Crown Victoria is prime example, used by Hwy Patrol, Gov agencies and taxi fleets.
5. Test drive and don't settle for the 15 minute sign and drive either. 12 hour minimum. If can't get dealer then rent one for a day from Hertz or whoever. Its worth it to find the little annoying things before hand.
6. Buy the car your wife wants."
10-03-2016,"Decide what type of vehicle you want first. Figure out what appeals to you in a way that you'll want to turn around and look at it when you leave it in a parking lot.

Figure out what will suit your lifestyle. Are you an outdoors person, do you have trailers to tow, will you be hauling supplies or anything? Do you want something fast and high performance? Do you want something luxurious?

Or do you just want something reliable that will get you to and from work?

Whatever you decide here, you'll be able to narrow it down to a few vehicles. Find some car lots that have those vehicles and go test drive them. Nothing makes a difference until you go drive them and see how they feel. Then buy the one you like the most if you can afford it."
30-04-2018,"Depends on what you like. People are somewhat split, in that they either like cars, or don't. People that like cars, usually have something they like about them, luxury, sportiness, size, speed, appearance, etc. People that don't care about them usually care more about reputation and reliability, and view cars as a necessary transportation appliance.

Some people end up liking cars that never really thought about it, and fall in love with what they buy and stick with it forever. Then there are the OCD freaks like me, who've owned pretty much every major car brand, plus many of the specialty brands, collected post war sports cars and some sedans, and ends up driving a boring generic pickup truck most of the time.

People like winners and losers, but in an industry that makes hundreds of different models with thousands of variants, there's no perfect car. There are likely many that will be good for you. If someone likes family sedans, then their experience using a Camry, Fusion, Impala, Altima, or Mazda 6 (or any others I didn't mention) will likely be the same. They are all nearly identical, other than the emotion people get all charged up with as it pertains to the brand they buy.

Same with SUVs or Pickups, or any class of car mostly. They are all so competitive, that theres more product differentiation in the marketing literature, than in the cars themselves.

Specialty cars are somewhat different. No one will mistake an Audi R8 for a Mazda Miata. But they are vastly different, and one cost 8 times the other. Same with a Corvette, or a Porsche.

So you need to ask yourself what you like. Speed or Luxury, Speed AND Luxury. Speed. Luxury. Space. None of those and just reliability.

Finally we don't know where in the world you are, but most car companies are pretty good these days. In the US, pretty much any car you buy will be a good choice, regardless of what people rattle off emotionally about the latest idiotic JD Power nonsense survey."
25-06-2019,"Drive it..

Attraction is blind, attraction is carnal. If its you who has to do the driving, take a test drive. They exist for a reason. Self clearing wind screen and space age sunroof will only get you so far if you don't like driving it. But yes, pay attention to safety ratings/features. Some people like plush comfort, others admire straight line performance. Personally I cannot resist back breaking, sharp handling cars.

So take a test drive.. these are only my 2 cents. Nadav, Ben and Michael have written objective and practical answers."
16-06-2020,"Assuming money is no option, because that is a big one . If so then look at your needs.

Is it for work or pleasure? Do you commute? Short or long trips? Do you have a family? Kids? A dog? What is the climate like where you live? Do you need air conditioning? Do you haul stuff? Would a half ton truck be useful to you?"
