Date,Opinion
29-02-2019,"I’ll make the presumption that you are relatively new to driving and as such are possibly going to have a minor ‘dingle’, so do not buy new, the newer the vehicle the higher the repair costs.

Ideally get a good old ‘basic’ car from the 70s or 80s for a while, as these provide a better driving experience in the sense that you get more feedback and as such you will obtain a better understanding of road conditions, better still ride a motorcycle, your understanding will be even greater, the more modern the car the more remote you are from what what is actually occurring.

The MAIN thing is that it is ‘safe’ as in no major faults that could be the cause of an accident, so get any potential vehicles checked by a suitably qualified person prior to purchase, be aware that second hand is typically ‘someone else’s problems’ so it is also a good idea to keep a portion of your car budget and set it aside for maintenance, about 25% is a good safe figure.

Unfortunately buying new is NO guarantee that you will not have issues soon after purchase, so unless you have an unlimited supply of income, setting money aside at the start will put you ‘ahead of the game’ and help prevent any car purchase from becoming a real ‘nightmare’ and reduce it to perhaps just a mere inconvenience if or when problems do arise.

Buy a car you can own outright, car finance is for the gullible and the impatient, no car is worth the additional cost of paying interest on borrowed money.

The other MAIN factor is ergonomics, if you are tall this is going to be a real problem finding something suitable, look up relevant data regarding sitting ergonomically correct, you need to be in a ‘relaxed’ position for ease of control, this does not mean that relaxed so you can fall asleep, but relaxed in that you are not holding yourself in an odd or uncomfortable manner to operate the controls, it needs to be ‘natural’.

Too many tall (5? 10? +) people need to recline the seat too far back just to be able to see out the windscreen which then means they must hold the steering wheel at arms length, a rather tiring position, this also puts an ’unnatural’ angle on the neck and this can lead to problems down the track, neck/spine problems are not fun. This laid back position also puts the door pillars in your line of sight out the vehicle sides, blocking your view of potential hazards, the internal rear view mirror also needs to be in a position whereby it does NOT block ANY of your forward vision, again this is going to be difficult to find.

Too many cars also have the foot pedals far too close together, so you need a model that does fit you in this respect also, this will help prevent accidents."
21-02-2020,"Know the Invoice Price

Once you’ve settled on what car is right for you, look up the invoice price for that car in our Buyer’s Guide. Invoice price is what the dealer pays the manufacturer for the car; the manufacturer’s suggested retail price (MSRP, or “sticker price”) includes hundreds—usually thousands—of dollars of profit for the dealer. With the exception of all-new or very popular models, you should be able to get a new car for closer to invoice than MSRP. Knowing the invoice price of your car will tell the dealer that you mean business and expect a good deal. Don’t walk into the dealership without this information.

Check the Manufacturer’s Website for Rebates

Many buyers will qualify for multiple rebates, some of which may not even be made public. You might belong to organizations or receive coupons in the mail that entitle you to additional rebates. Be aware of all rebates for which you qualify and make sure you receive them. Dealers are known for not giving buyers every rebate available to them, instead keeping one or two as additional profit.

Research the Dealers

Buying from a cooperative and fair dealer will save you money and headaches. There are a number of websites that allow people to post reviews of dealerships, but their coverage is spotty and incomplete. If you can’t find online reviews of the dealer you are considering, just talk to people. Your friends and neighbors purchase cars and should be honest with you about whether they were happy with their car or dealer.

Check Your Credit History

Most people who shop for cars will need a loan. How much that loan costs will depend on your credit history, and knowing your credit history will give you a better idea what to expect from lenders. The Fair and Accurate Credit Transaction Act of 2003 (FACTA) allows every consumer to get a free copy of his or her credit report once a year from each of the three major credit-reporting agencies (TransUnion, Experian, and Equifax). Get a copy of your credit report, and check it for accuracy. Pay the extra few dollars to get your credit score as well, as it is one of the major factors that banks use to determine your creditworthiness.

Get Your Own Financing

The biggest profit center for a car dealership is its finance department. Dealers contract with banks to get the best rates available but might not actually give you those rates. They might get you a car loan for 4.9 percent APR but draw up your finance contract at 5.9 percent. That one-percent markup is strictly profit for the dealer. You can often get a better interest rate from your local bank or credit union, or you can present the rates you were offered elsewhere to your salesman and challenge him to match or beat them. That being said, promotional rates from manufacturers—sometimes as low as zero percent—can be tough to beat.

Time Your Purchase

Dealers run on a month-to-month basis. At the end of the month, many will accept lower offers to reach their goals and qualify for manufacturer bonuses. If you’re not picky about having the latest and greatest, the end of a model year is a great time to get good deals on remaining inventory. And December—particularly the last week before the new year—is a slow time for car sales, so if you can hack some time out of your holiday-shopping schedule, it’s a wise time to buy.

Also, most dealerships are busier on weekends. The weekdays are generally slow, especially in the morning. If you come into the dealership on a midweek morning when business is slow, the salespeople are more likely to make a good deal as well. They need sales and they want to look busy, which keeps them motivated to give you a better deal and earn your business.

Do Not Buy a Car on Your First Visit

Use the first visit to look at and test-drive the car(s) you are interested in. Gather your information and then leave, and be adamant that you will not be buying a car today. This will communicate to the dealer that you are not going to be bullied. Watch what you say to the salespeople—especially if they ask you how much you are prepared to pay monthly—because whatever you say will be used as a starting point from which the dealer will go up when negotiations eventually start.

Get Internet Quotes from Several Dealers

Get quotes from multiple dealers before you ever visit any of them. If dealers know they are being pitted against other stores, it will be easier for you to get their best offer right off the bat, and waltzing into a dealership with a first offer already in hand gives you an advantage in negotiations.

Make an Appointment with the Sales Manager

Once your research is done and you are ready to head to the dealership to purchase a new car, call ahead and make an appointment. By calling a sales manager to make your appointment, you communicate that you are serious about this transaction and know what you are doing. You will still be paired with a salesman when you arrive, but your chances improve of getting a straight shooter who knows you won’t be easy fodder.

There is no guarantee you will get a good deal on a new-car purchase, nor is there a set price to negotiate toward with any car; pricing always varies with content, age, supply, and demand. But following these rules will start you in the right direction to get the best deal possible on your new car."
12-01-2018,"One tip: You should know that’s it's even more expensive to buy a new vehicle than you thought. In fact, when you buy a new car, just the extra costs incurred ( compared to buying used.) will easily pay for a used car.

It's starts at the car dealer. When you buy a loaf of bread, do you see additional costs for “delivery” and “preparation” on the receipt? You will when you buy a car. You may also see financing charges (not interest, but a charge for the privilege of paying interest!). There are too many other dealer nickel and dime schemes to list. Like adding high profit, low value items such as “undercoating” or floormats. These little trips into your wallet add up to hundreds, if not thousands of dollars.

The government will want it's money too. Oh my, look at that sales tax/VAT amount. Depending on your jurisdiction the sales tax alone will pay for a nice preowned car.

Your insurance costs will be high, because you’ll want to protect your expensive “investment” against total loss and theft.

To make sure your new car warranty is valid, its best to have work done at the dealer, where labor rates are 50% higher than independant shops. In any case, you’ll have to make sure any repair shop is using “genuine” manufacturer parts -more $$$.

And then there’s depreciation. Yup, the moment your shiny new car leaves the dealer, it's a used car. Count on losing a nice pile of cash daily.

Buying a new model, first year release? Congratulations, you are now an unpaid beta tester for the manufacturer. Prepare for some fun times in court proving that the fault in your new model is a manufacturing oopsie.

I do visit a new car dealer occasionally and I get the sales person to fill out the paperwork (on a slow day at the dealer) just to remind myself how much money I've saved over the years buying used. I estimate it's about $100,000 so far."
10-02-2018,"When looking for a vehicle, I start with deciding what I can afford.

I then decide what my needs are, Car, truck, SUV, or ?.

Once I have decided what I can afford, and what type of vehicle I need, I then list all the cars that fit my wants and needs.

Next is research! I start reading everything I can on the different vehicles that are still on my list. Anything that does not have high marks in dependability are eliminated. Of the remaining cars. It all depends what problems the vehicle has as to whether or not it stays on the list. I buy a car to drive, not to get to know my mechanic better and contribute to his kids college fund.

At this point I get into performance. The vehicle MUST handle well, have very good brakes, and the performance. If any of these are substandard, they are off my list!

By now, my list is pretty short. I start driving what is left on the list. If it isn’t comfortable, or it just doesn’t seem to fit me, it’s off of the list.

Then I decide what options I need and which ones I want. Find the cars still on my list and check out their prices.

Only now do I let my feelings/emotions enter into the picture.

Using this system, I have been extremely fortunate in my choices. I can only think of one car that I don’t think was the best choice. I actually didn’t follow my system, instead I thought it was too good to pass on and I bought it. A very short time later, I decided to sell it off. The very next morning, on my way to work, the car caught fire and was totaled. Best thing that ever happened with that car.

I’m not saying my system is the best out their, but it sure has served me well. My system does take a LOT of time, but I enjoy it to the fullest, and the results are well worth it.

Sorry for the length of this response, but buying a vehicle is a huge investment, and this should not be taken lightly."
19-10-2019,"Based on your question about diesel vs petrol, I assume you're not in the US so some of the advice here could be a little off with respect to your exact situation, but not by much…

Can I afford this car? Note, I didn't say can I afford the payment on this car. The payment should go into your bank account each month. That's how you're going to buy your next car when it's time to replace this one.
Can this car do nearly everything I need? If you're married with four children, you'll obviously need something with more space than if you're single. Likewise, if you frequently have to carry large objects, your car will have to accommodate them.
What is the cost to operate this car? This probably goes to your diesel vs petrol question, and you'll have to decide. In the US, there are very few diesel models available, although the VW TDI Jetta / Golf get exceedingly good fuel mileage compared to most gassers on the market, the recent VW emissions scandal notwithstanding.
Once my warranty expires, how reliable is this car likely to be? Does this manufacturer have a great reputation (like Toyota and Honda), or is their reputation a bit more sketchy? For example, some people have great long-term reliability from Chrysler products but based on what I've seen, I would never take the chance on owning one outside of the warranty period.
Service plan - I assume you're talking about the manufacturer’s warranty? Sure, a longer warranty is to your benefit - as long as you don't have to pay for it. Never purchase an extended warranty, which dealers in the US typically push."
27-03-2020,"First thing you need to know is your need. You must know for what purposes you are buying the car
How much you drive, you are buying Car for you or your family, where you mostly drive( city or highway)
Once you have figured it out, its time for you to know your butdget
Now as you have some definite reasons to buy a car as well as you know your budget. Now you just checked the cars in your budget having the things you need
for 1500km or more/months » go for diesel
Only city driving, »go for a hatchback

Only highway driving» go for a sedan

Driving in village and bad roads» Go for an SUV

At last,If you budget is above 5.5 lakhs, buy a car having safety features e.g Airbags, ABS(Anti lock breaking system), EBD( Electronic brakeforce distribution)"
16-12-2019,"Having worked for a very long time in Automobile industry Make a note of following things,which a Dealer will never tell you:-

Buy a car from a reputed Dealer only.

Thoroughly check the papers you receive from the Dealers Insurance,Engine number ,Number,your name on the Papers,Address.

Some time when car is being Bought from Factory to showroom During Logistics the car get damaged ,which the dealer never tells,they simple swap the part of the car with old car.Bumpers,Engine parts, Bonnet,Electrical parts,you will never come to know this,only if you are an insider you are aware of this Practices.Sad to say buy Good dealer also Practices this sometimes…

Check the Discount mentioned on the sales invoice whether property printed according to you needs, incase of company purchase cars.

Thoroughly check the car before taking the delivery because,inspect for Dents,scratches.

Check whether accessories that you have ordered, have been fitted property or not on your car.

Avoid Buying Accessories from the dealership,it is low in quality and they sell it for high margin make 40–50 % margin by selling you this cheap Chinese made products.Buying only basic accessories is fine Mud flaps,matting which are genuine.

If you want to fit any electrical items in your car getting it fitted from your Authorized dealer only ,or else warranty will get lapsed.

When taking delivery of your car make sure you take delivery during the day time only between 9am to 5:30 pm. To make sure there are no scratches,dents,if any issue on the car body will be visible only during the day time, and easy to spot it."
20-10-2019,"Define your budget. How much money do you have now (down payment) and how much do you want to spend per month? I ALWAYS recommend living below your means. It leads to financial stability, having savings and investments.
Define what you want from your car.. As a consultant I use the acronym S.P.A.C.C.E.D, Safety, Performance, Appearance, Comfort, Convenience, Economy, Durability. If you can quantify the importance of each to your situation, it will help narrow down your options considerably.
Use the information from 1 & 2 to come up with a list of options, and then go check them out, see which fits what you are looking for the most.

Remember, there is no one right answer. I sell Hyundai's, they make a lot of sense, for a lot of people, but not everyone. For instance they have America's Best Warranty. That matters if you care about economy. Not everyone does.
In 2012 they had the lowest average cost of repair of ANY manufacturer according to carmd .com That matters if you care about durability/economy.

Now any manufacturer is pretty damn safe now, and very similar in safety features unless you spend a lot of money. So the biggest variation in safety comes in size class. It's physics, the more mass your vehicle has, and the more crumple zone, the safer it is.
Performance and Economy are basically opposites on a sliding scale. You could choose a 10 in performance, 1 in economy like a ferrari. Or a 10 in economy, like subcompact commuter car, that's a 1 in performance. Or a little compromise like say a Hyundai Veloster that I'd say is like a 3 in engine performance, a 6 in handling performance, and a 9 in economy. But you have to decide how important each is.

Comfort is entirely subjective, you have to see if you think the seat, interior, and ride is comfortable for you.

Convenience is also subjective. Some people like everything digital, some the more retro interiors. Some people like tech everything, some are happy with a working radio.

I can ask questions and narrow it down to a class and a couple great car options in about 10 minutes, that's the job of a Sales consultant. If you find a good one they can help you, just keep in mind they want to sell one of THEIR cars. And many old car salesman just want to sell you whatever car makes them the most money, so take everything with a grain of salt."
23-05-2019,"Your lifestyle. How much driving each week will you do? What kind of terrains will you be traversing? Do you have other transportation? Go for the dream car. Long distances, high miles? Might want something practical and reliable.
Affordability. Choose a car that won't expense more than 25–30% of your income, including fuel and maintenance.
Features. What kind of driver are you? Do you need or will you use certain safety features? Do you need creature comforts such as heated seats? Do you eat or drink a lot in your car? Might want to get easy-to-clean seats.
Dealer reputation and size. Buy-here/pay-here shops don't have a slew of technicians to run the safety inspections properly, or it is too expensive to get *all* of the car's needs fixed in order to make a profit. Publicly-held dealerships don't want negative experiences getting back to the stockholders so they will do most of the important stuff, even if it means decreasing the profit on a preowned car.
Future resale value. If you buy a rare vehicle, or one that isn't mass-produced, you can expect a decent future value if you take care of it. The more features a car has, often the higher the resale value is. Durable leather seats, for example, will hold up longer than fabric or cheap leather-like seats. The more adaptable a vehicle is to many terrains and lifestyles, the more likely it will be in demand when you want to sell it."
12-04-2020,"This is a very subjective question as buying a car largely depends on the affordability. So will try to give a precise and concise answer IMO. This is very specific to India.

Work out the budget. My rule of thumb is to limit the budget to 60% of annual income.
Shortlist all options within that budget. This is the mot subjective area. I know people who don't buy a Maruti Suzuki or a Tata by principle. A friend of mine hates Hyundai cars because he feels nauseous every time he is in one! Also, post sales service quality is ignored by most at great later cost.
From this list, remove any car without basic safety features like ABS or airbags. These SHOULD NOT be options - again IMO.
Now that you have a shortlist, cross check features against each of them. Example: You may want an automatic hatchback in which case Hyundai Grand i10 is a popular choice. But even its top variant has ZERO airbags. Another example: You might drive your car only in the city in which case keyless entry and auto folding ORVMs are very useful features.
By now you should be down to 3 or 4 options. Test drive each of those - with family if possible and make your choice!"
31-01-2018,"I look at what I need in a car first. I have a fairly big family. My Camry technically seats 5 but not really. Four is the realistic number of seats. Sometimes that’s not enough. The trunk is a good size but isn’t always big enough. So I have a larger SUV that seats up to 8 and has good cargo space. One of the first things I look at is if the car meets my seating and cargo needs.

I look at price. Can I afford the car? Am I choking on the price? It scares me looking at prices and thinking I might need $40–50k for my next SUV. <gulp>

I look at repair reputation. I don’t want a lot of maintenance problems. I bought the Camry because I had too many problems with the Chevy predecessor.

Those are the main things I look for. After that are things like appearance, does it have all the gadgets and features I want. What’s the drivability like. For the SUV, what is the towing capacity.

I am looking for a car that meets my transportation needs. I want a car that drives nicely, but I am not looking for a “driver’s car”, even though it sounds great. I also don’t want a tinny, rattling, underpowered econobox. I would like decent fuel mileage but not to the point where I don’t have enough size or power. I want a car that is very reliable."
18-01-2018,"It will be 5 different set of reasons depending on if the vehicle will be new or used.

If the car is new :

Nr 1 Practicality.

It should have place for everybody in our family and all our stuff in case of long journeys. It shouldn't be too long because of tight parking spaces where we live and it should have enough holders for our drinks.

Nr 2 Economy / Performance

It must be a diesel around 150-180 hp. I drive a lot and diesel economy helps to compensate the expensive taxes diesels pay in my country. Low end torque also helps in heavy traffic and full cargo. Top speed doesn't matter when you are driving with the family onboard. If it does 100mph is more than enough.

Nr 3 Extra options

I like comfort and gadgets. If a specific model gives me the chance to make my car more personal is a big plus.

Nr 4 Price

It's nice if all the above comes with a nice price and good paying options

Nr 5 Insurance and Services

The service interval is not an issue cos I'm going to service the car more often. I'm most interested for the service cost while the car is under guarantee because after that I will service it by myself. And of course the insurance cost is something I consider when I buy a new car.

If the car is used

Nr 1 Rust

The first thing I check on a used car. Rust is cancer and it can be only worse.

Nr 2 Engine noise

I'll listen to it both idling and while driving. Strange noises is an instant no-go

Nr3 Transmission

Nice, smooth transition to all gears. Strange noises is an instant no-go

Nr4 Steering and suspension

I listen for noises and vibrations.

Nr 5 Price

If I find something wrong with the car that is not mentioned in the add, I'll try to get the price down. If not, well, there's plenty of cars to choose out there"
16-09-2017,"When buying a brand new car, the two factors are majorily important:

Value for money
Suitable features to fit our needs
When you have a limited budget, first thing to do is note down all available options in the budget. Then compare differences, and identify the car that includes most of the features you needed in your budget. Test drive that car, and enquire about its service. If you like it, buy with peace of mind. You can also rely on online reviews and public comments, however there are many biased opinions roaming online."
10-01-2018,"Cost (obviously)
Tax & Registration Fees (not-so-obvious and caught me off guard a few times - either paying cash or negotiating a sweet deal on a new car in-state and then getting to Out the Door numbers and being like “where did that extra 10% come from?!” - a few times that has pushed me from ‘I’m excited to get this car!’ to ‘Screw this, I’ll keep shopping for something else.’)
Insurance (again, not-so-obvious and surprised me a few times *cough* Tesla *cough*)
Power/Performance
Mileage (as I’ve gotten older, I get more annoyed with needing to fuel up gas or electric cars ‘too frequently’, less than once a week so this is a factor for me now. I loved having a huge gas tank in my Raptor and it annoyed the bejesus out of me having a small gas tank in my GT500 and Focus ST - for example).
“Washability” - I like my cars to look good and don’t do automatic car washes so something that usually plays around in the back of my head is how intricate the exterior design is, especially around the grill and how hard it is going to be for me to keep the car looking nice. It’s never caused me to NOT get a car, just something I think about.
These are more or less in order, especially 1, 2 and 3."
